retailer,manufacturer,product_name,category,price,url
zahcomputers,Bloody,Bloody V8M X’Glide Multi-Core Gaming Mouse,mouse,3799.0,https://zahcomputers.pk/product/bloody-v8m-xglide-multi-core-gaming-mouse/
zahcomputers,Bloody,Bloody A70 Light Strike 4000 CPI Gaming Mouse Black Crack,mouse,4799.0,https://zahcomputers.pk/product/bloody-a70-light-strike-4000-cpi-gaming-mouse-black-crack/
zahcomputers,Bloody,Bloody A70 Light Strike 4000 CPI Gaming Mouse Stone Black,mouse,4799.0,https://zahcomputers.pk/product/bloody-a70-light-strike-4000-cpi-gaming-mouse-stone-black/
zahcomputers,Bloody,Bloody L65 Max Lightweight Gaming Mouse RGB Animation 12000 CPI – Ultra Core 3 & 4 Activated | Honeycomb,mouse,4499.0,https://zahcomputers.pk/product/bloody-l65-max-lightweight-gaming-mouse-rgb-animation-12000-cpi-ultra-core-3-4-activated-honeycomb/
zahcomputers,Bloody,Bloody J95s Gaming Mouse with 2-Fire RGB Animation Black,mouse,4899.0,https://zahcomputers.pk/product/bloody-j95s-gaming-mouse-with-2-fire-rgb-animation-black/
zahcomputers,Bloody,"Bloody W95 Max  RGB Extra Fire Gaming Mouse – Ultra Core 3, 4 Activated – Sportes Red",mouse,5400.0,https://zahcomputers.pk/product/bloody-w95-max-rgb-extra-fire-gaming-mouse-ultra-core-3-4-activated-sportes-red/
zahcomputers,Bloody,"Bloody W72 Ultra Lightweight Gaming Mouse Black, Alpha Sensor, RapidSnap Rebound Technology",mouse,5399.0,https://zahcomputers.pk/product/bloody-w72-ultra-lightweight-gaming-mouse-black-alpha-sensor-rapidsnap-rebound-technology/
zahcomputers,Bloody,Bloody W63 Max Renegade RGB Gaming Mouse – Sunset,mouse,5199.0,https://zahcomputers.pk/product/bloody-w63-max-renegade-rgb-gaming-mouse-sunset/
zahcomputers,Bloody,Bloody W63 Max Renegade RGB Gaming Mouse – Midnight,mouse,5199.0,https://zahcomputers.pk/product/bloody-w63-max-renegade-rgb-gaming-mouse-midnight/
zahcomputers,Bloody,Bloody W60 Max Bloody RGB Gaming Mouse Stone Black,mouse,5199.0,https://zahcomputers.pk/product/bloody-w60-max-bloody-rgb-gaming-mouse-stone-black/
zahcomputers,Bloody,Bloody W60 Max Mini Lightweight RGB Gaming Mouse 12000 CPI | Honeycomb,mouse,4999.0,https://zahcomputers.pk/product/bloody-w60-max-mini-lightweight-rgb-gaming-mouse-12000-cpi-honeycomb/
zahcomputers,UGREEN,UGREEN 90372 Portable Wireless Mouse (Black),mouse,2250.0,https://zahcomputers.pk/product/ugreen-90372-portable-wireless-mouse-black/
zahcomputers,UGREEN,UGREEN 90538 FUN+ Wireless Mouse Blue,mouse,4000.0,https://zahcomputers.pk/product/ugreen-90538-fun-wireless-mouse-blue/
zahcomputers,Apple,"Apple MXK63 Magic Mouse USB-C, Black",mouse,36000.0,https://zahcomputers.pk/product/apple-mxk63-magic-mouse-usb-c-black/
zahcomputers,Apple,"Apple MXK53 Magic Mouse USB-C, White",mouse,28000.0,https://zahcomputers.pk/product/apple-mxk53-magic-mouse-usb-c-white/
zahcomputers,Logitech,Logitech G PRO 2 LIGHTSPEED Wireless Mouse Black,mouse,30000.0,https://zahcomputers.pk/product/logitech-pro-2-lightspeed-wireless-mouse-black/
zahcomputers,ATTACK,ATTACK SHARK X3PRO Three Modes 4K/8K Gaming Mouse – White,mouse,13000.0,https://zahcomputers.pk/product/attack-shark-x3pro-three-modes-4k-8k-gaming-mouse-white/
zahcomputers,UGREEN,UGREEN 90855 Wireless Mouse 2.4G USB Receiver with Ergonomic Design,mouse,2500.0,https://zahcomputers.pk/product/ugreen-90855-wireless-mouse-2-4g-usb-receiver-with-ergonomic-design/
zahcomputers,MSI,"MSI Vigor GK30 Combo White, 6-Zone RGB GK30 Gaming Keyboard & GM11 Gaming Mouse, Water Repellent & Splash-Proof, 5000 DPI",mouse,12899.0,https://zahcomputers.pk/product/msi-vigor-gk30-combo-white-6-zone-rgb-gk30-gaming-keyboard-gm11-gaming-mouse/
zahcomputers,MSI,"MSI Clutch GM51 Lightweight Wireless Gaming Mouse & Charging Dock, 26K DPI Optical Sensor, 2.4G & Bluetooth, 60M Omron Switches, Fast-Charging, 150Hr Battery, RGB, 5 Programmable Buttons, PC/Mac",mouse,22899.0,https://zahcomputers.pk/product/msi-clutch-gm51-lightweight-wireless-gaming-mouse/
zahcomputers,MSI,"MSI Clutch GM41 Lightweight V2 Gaming Mouse, 16000 DPI Optical Sensor, Symmetrical, 60M+ Click OMRON Switches, 6-Buttons, 65g, FriXionFree Cable, 1ms Latency, RGB Mystic Light",mouse,16699.0,https://zahcomputers.pk/product/msi-clutch-gm41-lightweight-v2-gaming-mouse/
zahcomputers,ATTACK,ATTACK SHARK X5 Wireless Gaming Mouse Black,mouse,4500.0,https://zahcomputers.pk/product/attack-shark-x5-wireless-gaming-mouse-black/
zahcomputers,ATTACK,ATTACK SHARK X6 Three Modes Gaming Mouse With Charging Dock – White,mouse,9500.0,https://zahcomputers.pk/product/attack-shark-x6-three-modes-gaming-mouse-with-charging-dock-white/
zahcomputers,Boost,Boost Prime Wireless Mouse,mouse,1349.0,https://zahcomputers.pk/product/boost-prime-wireless-mouse/
zahcomputers,Boost,Boost Raptor Wireless Gaming Mouse,mouse,3999.0,https://zahcomputers.pk/product/boost-raptor-wireless-gaming-mouse/
zahcomputers,HyperX,HyperX Pulsefire Haste 2 Gaming Mouse Black,mouse,15499.0,https://zahcomputers.pk/product/hyperx-pulsefire-haste-2-gaming-mouse-black/
zahcomputers,Asus,Asus ROG Harpe Ace Aim Lab Edition P713 Gaming Mouse,mouse,29299.0,https://zahcomputers.pk/product/asus-rog-harpe-ace-aim-lab-edition-gaming-mouse/
zahcomputers,ATTACK,ATTACK SHARK R1 Wireless Gaming Mouse – White,mouse,6000.0,https://zahcomputers.pk/product/attack-shark-r1-wireless-gaming-mouse-white/
zahcomputers,ATTACK,ATTACK SHARK R1 Wireless Gaming Mouse – Black,mouse,6000.0,https://zahcomputers.pk/product/attack-shark-r1-wireless-gaming-mouse-black/
zahcomputers,HP,"HP Z3700 Dual Bluetooth 5.0, USB-A dongle, 2.4 GHz wireless Mouse Silver",mouse,4700.0,https://zahcomputers.pk/product/hp-z3700-dual-bluetooth-5-0-usb-a-dongle-2-4-ghz-wireless-mouse-silver/
zahcomputers,HP,"HP Z3700 Dual Bluetooth 5.0, USB-A dongle, 2.4 GHz wireless Mouse Black",mouse,4700.0,https://zahcomputers.pk/product/hp-z3700-dual-bluetooth-5-0-usb-a-dongle-2-4-ghz-wireless-mouse-black/
zahcomputers,HP,HP 250 Dual-Mode 2.4 Ghz or Bluetooth Mouse,mouse,3950.0,https://zahcomputers.pk/product/hp-250-dual-mode-2-4-ghz-or-bluetooth-mouse/
zahcomputers,HP,HP 240 Bluetooth 5.1 Wireless Mouse Silver,mouse,3600.0,https://zahcomputers.pk/product/hp-240-bluetooth-5-1-wireless-mouse-silver/
zahcomputers,HP,HP 240 Bluetooth 5.1 Wireless Mouse Red,mouse,3650.0,https://zahcomputers.pk/product/hp-240-bluetooth-5-1-wireless-mouse-red/
zahcomputers,HP,HP 240 Bluetooth 5.1 Wireless Mouse Black,mouse,3650.0,https://zahcomputers.pk/product/hp-240-bluetooth-5-1-wireless-mouse-black/
zahcomputers,MSI,MSI Forge GK100 RGB Combo Gaming Keyboard Gaming Mouse,mouse,6299.0,https://zahcomputers.pk/product/msi-forge-gk100-rgb-combo-gaming-keyboard-gaming-mouse/
zahcomputers,MSI,"MSI Vigor GK30 Combo Gaming Keyboard,GM11 Gaming Mouse",mouse,12500.0,https://zahcomputers.pk/product/msi-vigor-gk30-combo-gaming-keyboardgm11-gaming-mouse/
zahcomputers,Logitech,Logitech Pebble 2 Wireless Mouse M350S (Rose) 910-006987,mouse,5500.0,https://zahcomputers.pk/product/logitech-pebble-wireless-mouse-m350-rose-910-006987/
zahcomputers,Logitech,Logitech M240 Silent Wireless Bluetooth Mouse Rose 910-007124,mouse,3500.0,https://zahcomputers.pk/product/logitech-m240-silent-wireless-bluetooth-mouse-rose-910-007124/
zahcomputers,Logitech,Logitech M240 Silent Wireless Bluetooth Mouse Off-White 910-007123,mouse,3900.0,https://zahcomputers.pk/product/logitech-m240-silent-wireless-bluetooth-mouse-off-white-910-007123/
zahcomputers,Logitech,Logitech M240 Silent Wireless Bluetooth Mouse Graphite 910-007122,mouse,3800.0,https://zahcomputers.pk/product/logitech-m240-silent-wireless-bluetooth-mouse-graphite-910-007122/
zahcomputers,Logitech,Logitech Pebble 2 Wireless Mouse M350S (White) 910-006986,mouse,5100.0,https://zahcomputers.pk/product/logitech-pebble-2-wireless-mouse-m350-white/
zahcomputers,Boost,Boost Work Buddy Wireless Office Keyboard+Mouse Combo,mouse,2999.0,https://zahcomputers.pk/product/boost-work-buddy-wireless-office-keyboardmouse-combo/
zahcomputers,Logitech,Logitech Spotlight Presentation Remote (Slate) 910-004863,mouse,25000.0,https://zahcomputers.pk/product/logitech-spotlight-presentation-remote-slate-910-004863/
zahcomputers,Logitech,Logitech MK240 Wireless Keyboard and Mouse Combo with Nano receiver – White 920-008201,mouse,5350.0,https://zahcomputers.pk/product/logitech-mk240-wireless-keyboard-and-mouse-combo-with-nano-receiver-white-920-008201/
zahcomputers,Logitech,Logitech MK240 Wireless Keyboard and Mouse Combo with Nano receiver – Black 920-008202,mouse,5350.0,https://zahcomputers.pk/product/logitech-mk240-wireless-keyboard-and-mouse-combo-with-nano-receiver-black-920-008202/
zahcomputers,Logitech,Logitech M331 Silent Plus Wireless Mouse Black 910-004914,mouse,3800.0,https://zahcomputers.pk/product/logitech-m331-silent-plus-wireless-mouse-black-910-004914/
zahcomputers,Logitech,Logitech Lift Vertical Ergonomic Wireless Mouse (Rose) 910-006481,mouse,14300.0,https://zahcomputers.pk/product/logitech-lift-vertical-ergonomic-wireless-mouse-rose-910-006481/
zahcomputers,Logitech,Logitech Signature M650L Mouse Graphite 910-006247,mouse,7500.0,https://zahcomputers.pk/product/logitech-signature-m650l-mouse-graphite-910-006247/
zahcomputers,Logitech,Logitech M190 Wireless Mouse Full Size Comfort Curve Design 1000DPI Red 910-005915,mouse,3200.0,https://zahcomputers.pk/product/logitech-m190-wireless-mouse-full-size-comfort-curve-design-1000dpi-red-910-005915/
zahcomputers,Logitech,Logitech M187 Wireless Ultra Portable Mouse (White) 910-005380,mouse,3200.0,https://zahcomputers.pk/product/logitech-m187-wireless-ultra-portable-mouse-white-910-005380/
zahcomputers,Logitech,Logitech B100 Corded Mouse – Wired USB Mouse 910-006605,mouse,1000.0,https://zahcomputers.pk/product/logitech-b100-corded-mouse-wired-usb-mouse-910-006605/
zahcomputers,Razer,Razer DeathAdder V3 Pro White Classic Base 1000 Hz Ultra-lightweight Wireless Ergonomic Esports Mouse,mouse,57500.0,https://zahcomputers.pk/product/razer-deathadder-v3-pro-white-classic-base-1000-hz-ultra-lightweight-wireless-ergonomic-esports-mouse/
zahcomputers,Razer,Razer Basilisk V3 X HyperSpeed Customizable Wireless Gaming Mouse with RGB Lighting,mouse,27000.0,https://zahcomputers.pk/product/razer-basilisk-v3-x-hyperspeed-customizable-wireless-gaming-mouse-with-rgb-lighting/
zahcomputers,XPG,XPG ALPHA Wireless Gaming Mouse – Black,mouse,12000.0,https://zahcomputers.pk/product/xpg-alpha-wireless-gaming-mouse-black/
zahcomputers,XPG,XPG ALPHA Wired Gaming Mouse – Black,mouse,9000.0,https://zahcomputers.pk/product/xpg-alpha-wired-gaming-mouse-black/
zahcomputers,Corsair,Corsair IRONCLAW RGB Wireless Gaming Mouse,mouse,15300.0,https://zahcomputers.pk/product/corsair-ironclaw-rgb-wireless-gaming-mouse/
zahcomputers,Logitech,Logitech Signature M650M Mouse Graphite 910-006262,mouse,7500.0,https://zahcomputers.pk/product/logitech-signature-m650-mouse-graphite-910-006262/
zahcomputers,Logitech,Logitech M190 Full-Size Wireless Mouse (Mid-Gray) 910-005913,mouse,3000.0,https://zahcomputers.pk/product/logitech-m190-full-size-wireless-mouse-mid-gray-910-005913/
zahcomputers,Asus,Asus ROG Keris P709 Wireless AimPoint Gaming Mouse,mouse,18999.0,https://zahcomputers.pk/product/asus-rog-keris-p709-wireless-aimpoint-gaming-mouse/
zahcomputers,ASUS,ASUS TUF Gaming P309 M3 Gen II ultralight 59-gram wired Gaming Mouse,mouse,5800.0,https://zahcomputers.pk/product/asus-tuf-gaming-p309-m3-gen-ii-ultralight-59-gram-wired-gaming-mouse/
zahcomputers,Glorious,Glorious Model O2 RGB Wired Gaming Mouse Matte Black,mouse,18990.0,https://zahcomputers.pk/product/glorious-model-o2-rgb-wired-gaming-mouse-matte-black/
zahcomputers,SteelSeries,SteelSeries Aerox 9 Wireless Optical Wireless Gaming Mouse,mouse,37000.0,https://zahcomputers.pk/product/steelseries-aerox-9-wireless-optical-wireless-gaming-mouse/
zahcomputers,SteelSeries,SteelSeries Prime Mini Wireless Optical Wireless Gaming Mouse,mouse,18000.0,https://zahcomputers.pk/product/steelseries-prime-mini-wireless-optical-wireless-gaming-mouse/
zahcomputers,Steelseries,Steelseries Rival 300S Ergonomic Competitive Prism RGB TrueMove1 Sensor 7200 CPI Gaming Mouse,mouse,17500.0,https://zahcomputers.pk/product/steelseries-rival-300s-ergonomic-competitive-prism-rgb-truemove1-sensor-7200-cpi-gaming-mouse/
zahcomputers,SteelSeries,SteelSeries Prime+ Optical Wired Gaming Mouse,mouse,13000.0,https://zahcomputers.pk/product/steelseries-prime-optical-wired-gaming-mouse/
zahcomputers,Asus,Asus ROG Chakram X P708 Origin Gaming Mouse,mouse,37199.0,https://zahcomputers.pk/product/asus-rog-chakram-x-p708-origin-gaming-mouse/
zahcomputers,ASUS,ASUS ROG Spatha X P707 Wireless Gaming Mouse,mouse,37199.0,https://zahcomputers.pk/product/asus-rog-spatha-x-p707-wireless-gaming-mouse/
zahcomputers,Asus,Asus ROG Strix Impact III P518 Gaming Mouse,mouse,10500.0,https://zahcomputers.pk/product/asus-rog-strix-impact-iii-p518-gaming-mouse/
zahcomputers,EASE,EASE EMB100 Bluetooth Wireless Mouse,mouse,2000.0,https://zahcomputers.pk/product/ease-emb100-bluetooth-wireless-mouse/
zahcomputers,EASE,EASE EM210 USB Wireless Mouse,mouse,1380.0,https://zahcomputers.pk/product/ease-em210-usb-wireless-mouse/
zahcomputers,EASE,EASE EK100 Wired Keyboard,mouse,1437.0,https://zahcomputers.pk/product/ease-ek100-wired-keyboard/
zahcomputers,Logitech,Logitech Lift Vertical Ergonomic Wireless Mouse White 910-006480,mouse,14800.0,https://zahcomputers.pk/product/logitech-lift-vertical-ergonomic-wireless-mouse-white-910-006480/
zahcomputers,Logitech,Logitech M720 Triathalon Multi-Device Wireless Mouse 910-004792,mouse,14500.0,https://zahcomputers.pk/product/logitech-m720-triathalon-multi-device-wireless-mouse-910-004792/
zahcomputers,Logitech,Logitech M331 Silent Plus Wireless Mouse-Red 910-004916,mouse,3800.0,https://zahcomputers.pk/product/logitech-m331-silent-plus-wireless-mouse-red-910-004914/
zahcomputers,Razer,Razer Viper V2 Pro Hyperspeed Wireless Gaming Mouse White,mouse,57500.0,https://zahcomputers.pk/product/razer-viper-v2-pro-hyperspeed-wireless-gaming-mouse-white/
zahcomputers,Logitech,Logitech B175 Wireless Mouse Black 910-002635,mouse,2250.0,https://zahcomputers.pk/product/logitech-b175-wireless-mouse-black/
zahcomputers,Logitech,Logitech R400 Presenter Wireless – Black 910-001361,mouse,7200.0,https://zahcomputers.pk/product/logitech-r400-presenter-wireless-black-910-001361/
zahcomputers,ASUS,ASUS ROG Gladius III Wireless 2.4GHz and Bluetooth Gaming Mouse,mouse,26699.0,https://zahcomputers.pk/product/asus-rog-gladius-iii-wireless-2-4ghz-and-bluetooth-gaming-mouse/
zahcomputers,ASUS,ASUS TUF Gaming M4 Air P307 Lightweight Gaming Mouse,mouse,9299.0,https://zahcomputers.pk/product/asus-tuf-gaming-m4-air-p307-lightweight-gaming-mouse/
zahcomputers,ASUS,ASUS TUF M4 P306 Gaming Wireless Dual Modes  Gaming Mouse,mouse,12199.0,https://zahcomputers.pk/product/asus-tuf-m4-p306-gaming-wireless-dual-modes-gaming-mouse/
zahcomputers,EASE,EASE EM100 Wired Optical USB Mouse,mouse,1200.0,https://zahcomputers.pk/product/ease-em100-wired-optical-usb-mouse/
zahcomputers,EASE,EASE EGM100 Pro Gaming Mouse,mouse,1150.0,https://zahcomputers.pk/product/ease-egm100-pro-gaming-mouse/
zahcomputers,EASE,EASE EGM110 Gaming Mouse,mouse,2875.0,https://zahcomputers.pk/product/ease-egm110-gaming-mouse/
zahcomputers,EASE,EASE EKM200 Wireless Keyboard and Mouse Combo,mouse,3450.0,https://zahcomputers.pk/product/ease-ekm200-wireless-keyboard-and-mouse-combo/
zahcomputers,EASE,EASE EKM210 Wireless Keyboard and Mouse Combo,mouse,4099.0,https://zahcomputers.pk/product/ease-ekm210-wireless-keyboard-and-mouse-combo/
zahcomputers,Apple,Apple MK2E3 Magic Mouse 3 Silver,mouse,22000.0,https://zahcomputers.pk/product/apple-magic-mouse-3-silver/
zahcomputers,Logitech,Logitech MK540 ADVANCED Wireless Keyboard and Mouse Combo 920-008682,mouse,9700.0,https://zahcomputers.pk/product/logitech-mk540-advanced-wireless-keyboard-and-mouse-combo-920-008693/
zahcomputers,SteelSeries,SteelSeries AEROX 3 2022 Onyx 6 Buttons Wireless Optical 8500 dpi Gaming Mouse,mouse,26000.0,https://zahcomputers.pk/product/steelseries-aerox-3-2022-onyx-6-buttons-wireless-optical-8500-dpi-gaming-mouse/
zahcomputers,SteelSeries,SteelSeries AEROX 3 2022 Onyx 6 Buttons USB-C Wired Optical 8500 dpi Gaming Mouse,mouse,17000.0,https://zahcomputers.pk/product/steelseries-aerox-3-2022-onyx-6-buttons-usb-c-wired-optical-8500-dpi-gaming-mouse/
zahcomputers,SteelSeries,SteelSeries AEROX 3 2022 Snow 6 Buttons USB-C Wired Optical 8500 dpi Gaming Mouse,mouse,17000.0,https://zahcomputers.pk/product/steelseries-aerox-3-2022-snow-6-buttons-usb-c-wired-optical-8500-dpi-gaming-mouse/
zahcomputers,SteelSeries,SteelSeries Aerox 5 Lightweight 1800CPI Wired RGB Gaming Mouse,mouse,21000.0,https://zahcomputers.pk/product/steelseries-aerox-5-lightweight-1800cpi-wired-rgb-gaming-mouse/
zahcomputers,Steelseries,Steelseries Prime mouse Right-hand USB Type-A Optical 18000 DPI Gaming Mouse,mouse,14500.0,https://zahcomputers.pk/product/steelseries-prime-mouse-right-hand-usb-type-a-optical-18000-dpi-gaming-mouse/
zahcomputers,Logitech,"Logitech Bolt MX Master 3S Mouse Bluetooth, USB Receiver Pale Gray 910-006560",mouse,27999.0,https://zahcomputers.pk/product/logitech-bolt-mx-master-3s-mouse-bluetooth-usb-receiver-pale-gray-910-006560/
zahcomputers,Logitech,"Logitech Bolt MX Master 3S Mouse Bluetooth, USB Receiver Graphit 910-006559",mouse,26999.0,https://zahcomputers.pk/product/logitech-bolt-mx-master-3s-mouse-bluetooth-usb-receiver-graphit-910-006559/
zahcomputers,Logitech,Logitech MK270R Wireless Combo Keyboard 920-006316,mouse,6350.0,https://zahcomputers.pk/product/logitech-mk270r-wireless-combo-keyboard/
zahcomputers,Logitech,Logitech G502 X Wired Hyper-Fast Scroll Gaming Mouse with HERO 25K Sensor – Black 910-006140,mouse,17000.0,https://zahcomputers.pk/product/logitech-g502-x-wired-hyper-fast-scroll-gaming-mouse-with-hero-25k-sensor-black/
zahcomputers,Razer,Razer Viper V2 Pro Hyperspeed Wireless Gaming Mouse Black,mouse,57500.0,https://zahcomputers.pk/product/razer-viper-v2-pro-hyperspeed-wireless-gaming-mouse-black/
zahcomputers,Glorious,Glorious Model O Minus Glossy 59G Gaming Mouse Black,mouse,8800.0,https://zahcomputers.pk/product/glorious-model-o-minus-glossy-59g-gaming-mouse-black/
zahcomputers,Glorious,Glorious Model I White 9 Buttons 1 x Wheel USB-A 2.0 Wired 19000 dpi Gaming Mouse,mouse,11999.0,https://zahcomputers.pk/product/glorious-model-i-white-9-buttons-1-x-wheel-usb-a-2-0-wired-19000-dpi-gaming-mouse/
zahcomputers,Logitech,Logitech G G305 Mouse – Wireless – Black,mouse,14999.0,https://zahcomputers.pk/product/logitech-g-g305-mouse-wireless-black/
zahcomputers,Corsair,Corsair HARPOON RGB PRO FPS/MOBA Gaming Mouse,mouse,8000.0,https://zahcomputers.pk/product/corsair-harpoon-rgb-pro-fps-moba-gaming-mouse/
zahcomputers,Logitech,Logitech MK220 Wireless Keyboard And Mouse Combo,mouse,4850.0,https://zahcomputers.pk/product/logitech-mk220-wireless-keyboard-and-mouse-combo/
zahcomputers,Logitech,Logitech MX Master 2S Bluetooth Wireless Mouse 910-005965,mouse,23990.0,https://zahcomputers.pk/product/logitech-mx-master-2s-wireless-mouse-910-005965/
zahcomputers,Logitech,Logitech M331 Silent Plus Wireless Mouse-Blue 910-004915,mouse,3800.0,https://zahcomputers.pk/product/logitech-m331-silent-plus-wireless-mouse-blue-910-004915/
zahcomputers,Logitech,Logitech G703 LightSpeed Wireless Lag-Free Gaming Mouse,mouse,24990.0,https://zahcomputers.pk/product/logitech-g703-lightspeed-wireless-lag-free-gaming-mouse/
zahcomputers,Logitech,Logitech G403 Hero Gaming Mouse,mouse,11500.0,https://zahcomputers.pk/product/logitech-g403-hero-gaming-mouse/
zahcomputers,Steelseries,Steelseries Sensei Ten Wired Optical Gaming Mouse,mouse,23000.0,https://zahcomputers.pk/product/steelseries-sensei-ten-wired-optical-gaming-mouse/
zahcomputers,SteelSeries,SteelSeries Rival 710 Gaming Mouse – Tactile Alerts and OLED Display,mouse,21000.0,https://zahcomputers.pk/product/steelseries-rival-710-gaming-mouse-tactile-alerts-and-oled-display/
zahcomputers,SteelSeries,SteelSeries Rival 3 Wireless Gaming Mouse,mouse,13500.0,https://zahcomputers.pk/product/steelseries-rival-3-wireless-gaming-mouse/
zahcomputers,SteelSeries,SteelSeries Rival 3 Wired Optical Gaming Mouse,mouse,10200.0,https://zahcomputers.pk/product/steelseries-rival-3-wired-optical-gaming-mouse/
zahcomputers,Logitech,Logitech MK295 Silent Wireless Combo Keyboard Mouse Graphite 920-009814,mouse,7450.0,https://zahcomputers.pk/product/logitech-mk295-silent-wireless-combo-keyboard-mouse-graphite/
zahcomputers,Gamdias,Gamdias Zeus M2 RGB Gaming Mouse,mouse,4250.0,https://zahcomputers.pk/product/gamdias-zeus-m2-rgb-gaming-mouse/
zahcomputers,Gamdias,Gamdias Hades M1 Wired & Wireless RGB Gaming Mouse,mouse,9400.0,https://zahcomputers.pk/product/gamdias-hades-m1-wired-wireless-rgb-gaming-mouse/
zahcomputers,Gamdias,Gamdias Hermes E1B RGB 4-In-1 Gaming Combo,mouse,15700.0,https://zahcomputers.pk/product/gamdias-hermes-e1b-rgb-4-in-1-gaming-combo/
zahcomputers,Gamdias,Gamdias Ares P2 RGB 3-In-1 Gaming Combo,mouse,8150.0,https://zahcomputers.pk/product/gamdias-ares-p2-rgb-3-in-1-gaming-combo/
zahcomputers,Gamdias,Gamdias Ares M2 & Zeus E2 3-in-1 Gaming Combo,mouse,6150.0,https://zahcomputers.pk/product/gamdias-ares-m2-zeus-e2-3-in-1-gaming-combo/
zahcomputers,HyperX,HyperX Pulsefire Core RGB Gaming Mouse,mouse,8999.0,https://zahcomputers.pk/product/kingston-hyperx-pulsefire-core-rgb-gaming-mouse/
zahcomputers,Logitech,Logitech G102 LightSync 2nd Edition Gaming Mouse,mouse,4850.0,https://zahcomputers.pk/product/logitech-g102-lightsync-2nd-edition-gaming-mouse/
zahcomputers,Aula,Aula S12 USB Wired Gaming Mouse,mouse,2000.0,https://zahcomputers.pk/product/aula-s12-usb-wired-gaming-mouse/
zahcomputers,Glorious,Glorious Mouse Bungee (White) G-MB-White,mouse,4999.0,https://zahcomputers.pk/product/glorious-mouse-bungee-white-g-mb-white/
zahcomputers,Logitech,"Logitech MK850 Performance Wireless Keyboard and Mouse Combo, 920-010568",mouse,34299.0,https://zahcomputers.pk/product/logitech-mk850-performance-wireless-keyboard-and-mouse-combo-920-008233/
zahcomputers,Logitech,Logitech Wireless Combo MK345,mouse,8000.0,https://zahcomputers.pk/product/logitech-wireless-combo-mk345/
zahcomputers,Logitech,Logitech MK235 Wireless Keyboard and Mouse – 920-007939,mouse,5350.0,https://zahcomputers.pk/product/logitech-mk235-wireless-keyboard-and-mouse-920-007939/
zahcomputers,Logitech,Logitech MK275 Wireless Keyboard and Mouse Combo 920-008460,mouse,6200.0,https://zahcomputers.pk/product/logitech-mk275-wireless-keyboard-and-mouse-combo-920-008460/
zahcomputers,Glorious,Glorious Model D (Glossy Black) Extreme Lightweight Ergonomic Gaming Mouse 69G,mouse,8800.0,https://zahcomputers.pk/product/glorious-model-d-glossy-black-extreme-lightweight-ergonomic-gaming-mouse-69g/
zahcomputers,Glorious,Glorious Model D (Glossy White) Extreme Lightweight Ergonomic Gaming Mouse 69G,mouse,8800.0,https://zahcomputers.pk/product/glorious-model-d-glossy-white-extreme-lightweight-ergonomic-gaming-mouse-69g/
zahcomputers,Logitech,Logitech G Pro Gaming Mouse with HERO 16K Sensor for Esports 910-005442,mouse,9500.0,https://zahcomputers.pk/product/logitech-g-pro-gaming-mouse-with-hero-16k-sensor-for-esports-910-005442/
zahcomputers,Logitech,Logitech G502 HERO High Performance Gaming Mouse – 910-005472,mouse,11200.0,https://zahcomputers.pk/product/logitech-g502-hero-high-performance-gaming-mouse-910-005472/
zahcomputers,Logitech,Logitech G403 Prodigy Gaming Mouse (910-004826),mouse,11500.0,https://zahcomputers.pk/product/logitech-g403-prodigy-gaming-mouse-910-004826/
zahcomputers,Logitech,Logitech G402 Hyperion Fury Ultra-Fast FPS Gaming Mouse 910-004070,mouse,6900.0,https://zahcomputers.pk/product/logitech-g402-hyperion-fury-ultra-fast-fps-gaming-mouse-910-004070/
zahcomputers,Logitech,Logitech Pebble Wireless Mouse M350 (Rose),mouse,5000.0,https://zahcomputers.pk/product/logitech-pebble-wireless-mouse-m350-rose/
zahcomputers,Logitech,"Logitech M235 Wireless Mouse , 2nd Generation (Grey: PN: 910-003384)",mouse,3400.0,https://zahcomputers.pk/product/logitech-m235-wireless-mouse-2nd-generation-grey-pn-910-003384/
zahcomputers,Logitech,Logitech M235 Wireless Mouse – Steel Blue – 910-003392,mouse,3400.0,https://zahcomputers.pk/product/logitech-m235-wireless-mouse-steel-blue-910-003392/
zahcomputers,Logitech,Logitech M221 Silent Wireless Mouse – Charcoal- 910-004882,mouse,3000.0,https://zahcomputers.pk/product/logitech-m221-silent-wireless-mouse-charcoal-910-004882/
zahcomputers,Logitech,Logitech Wireless Mini Mouse M187 – Black – 910-002741,mouse,3200.0,https://zahcomputers.pk/product/logitech-wireless-mini-mouse-m187-black-910-002741/
zahcomputers,Logitech,Logitech Wireless Mouse M185 – Grey – 910-002255,mouse,2750.0,https://zahcomputers.pk/product/logitech-wireless-mouse-m185-grey-910-002255/
zahcomputers,Logitech,Logitech M171 Wireless Mouse – Grey/Black – 910-004655,mouse,3000.0,https://zahcomputers.pk/product/logitech-m171-wireless-mouse-grey-black-910-004655/
zahcomputers,Logitech,Logitech M171 Wireless Mouse – Blue/Black – 910-004656,mouse,2400.0,https://zahcomputers.pk/product/logitech-m171-wireless-mouse-blue-black-910-004656/
zahcomputers,Logitech,Logitech M171 Wireless Mouse – Red/Black – 910-004657,mouse,3000.0,https://zahcomputers.pk/product/logitech-m171-wireless-mouse-red-black-910-004657/
zahcomputers,Logitech,Logitech M170 Wireless Mouse – Black – 910-004658,mouse,2400.0,https://zahcomputers.pk/product/logitech-m170-wireless-mouse-black-910-004658/
