retailer,manufacturer,product_name,category,price,url
zahcomputers,AULA,"AULA Wind SC580X Wireless Gaming Mouse Tri-Mode Connectivity 10,000 DPI Lightweight Ergonomic Design (Black)",mouse,6000.0,https://zahcomputers.pk/product/aula-wind-sc580x-wireless-gaming-mouse-tri-mode-connectivity-10000-dpi-lightweight-ergonomic-design-black/
zahcomputers,UGREEN,"UGREEN 65042 Ergonomic Mouse Wireless Bluetooth Vertical Mouse Dual-Mode (BT 5.4 & USB 2.4G), Quiet Clicks, 4 Adjustable DPI (1000/1600/2000/4000) Compatible with Windows/Mac/Linux/Android/ChromeOS",mouse,3500.0,https://zahcomputers.pk/product/ugreen-65042-ergonomic-mouse-wireless-bluetooth-vertical-mouse-dual-mode-bt-5-4-usb-2-4g-quiet-clicks-4-adjustable-dpi-1000-1600-2000-4000-compatible-with-windows-mac-linux-android-chromeo/
zahcomputers,Aula,Aula Mountain S12Pro Wired 2800 DPI Optical Gamer Mouse,mouse,2600.0,https://zahcomputers.pk/product/aula-mountain-s12pro-wired-2800-dpi-optical-gamer-mouse/
zahcomputers,Fantech,Fantech MP64 Basic XL Smooth Surface Water Resistance Non-Slip Base Gaming Mouse Pad For Keyboard & Mouse 64x21cm Speed Edition,mouse,1299.0,https://zahcomputers.pk/product/fantech-mp64-basic-xl-smooth-surface-water-resistance-non-slip-base-gaming-mouse-pad-for-keyboard-mouse-64x21cm-speed-edition/
zahcomputers,Fantech,Fantech MP296 Vigil Gaming Mouse Pad,mouse,1049.0,https://zahcomputers.pk/product/fantech-mp296-vigil-gaming-mouse-pad/
zahcomputers,Fantech,Fantech Thor X9 Wired Gaming Mouse RGB 7 Macro Buttons Programmable True 4800 DPI Claw Grip Comfort Beginner Gaming Mouse for Window PC Black,mouse,3149.0,https://zahcomputers.pk/product/fantech-thor-x9-wired-gaming-mouse-rgb-7-macro-buttons-programmable-true-4800-dpi-claw-grip-comfort-beginner-gaming-mouse-for-window-pc-black/
zahcomputers,Fantech,Fantech Crypto II VX7V2 Wired Gaming Mouse – Optical Sensor 8000 DPI 60 IPS 15G Acceleration 125Hz Polling Huano 10M-Click Switches 6 Programmable Buttons 4-Color LED Illumination Ergonomic Design,mouse,2849.0,https://zahcomputers.pk/product/fantech-crypto-ii-vx7v2-wired-gaming-mouse-optical-sensor-8000-dpi-60-ips-15g-acceleration-125hz-polling-huano-10m-click-switches-6-programmable-buttons-4-color-led-illumination-ergonomic-design/
zahcomputers,Fantech,Fantech Rhasta II G13 Gaming Mouse Optic Sensor 2400 DPI Resolution Ambidextrous Design RGB Lights Silicone & Rubber Scroll Wheel 1.8m Cable Black,mouse,1749.0,https://zahcomputers.pk/product/fantech-rhasta-ii-g13-gaming-mouse-optic-sensor-2400-dpi-resolution-ambidextrous-design-rgb-lights-silicone-rubber-scroll-wheel-1-8m-cable-black/
zahcomputers,CrystalX,CrystalX Frost X20 Ultra-Lightweight Design Wireless Gaming Mouse White,mouse,6500.0,https://zahcomputers.pk/product/crystalx-frost-x20-ultra-lightweight-design-wireless-gaming-mouse-white/
zahcomputers,CrystalX,CrystalX NOVA X21 Coco Super Lightweight Design Wireless Gaming Mouse Red,mouse,10500.0,https://zahcomputers.pk/product/crystalx-nova-x21-coco-super-lightweight-design-wireless-gaming-mouse/
zahcomputers,Asus,Asus P723 ROG Harpe II Ace Wireless Gaming Mouse – Black,mouse,34299.0,https://zahcomputers.pk/product/asus-p723-rog-harpe-ii-ace-wireless-gaming-mouse-black/
zahcomputers,Asus,Asus P722  Rog Keris II Origin Wireless Gaming Mouse – Black,mouse,29699.0,https://zahcomputers.pk/product/asus-p722-rog-keris-ii-origin-wireless-gaming-mouse/
zahcomputers,Asus,Asus P524  Rog Harpe Mini Core Wired Gaming Mouse,mouse,14499.0,https://zahcomputers.pk/product/asus-p524-rog-harpe-mini-core-wired-gaming-mouse/
zahcomputers,Asus,Asus P523 Rog Gladius III Core Wired Gaming Mouse,mouse,11699.0,https://zahcomputers.pk/product/asus-p523-rog-gladius-iii-core-wired-gaming-mouse/
zahcomputers,Philips,Philips SPK9414 Wired gaming mouse,mouse,2800.0,https://zahcomputers.pk/product/philips-spk9414-wired-gaming-mouse/
zahcomputers,Logitech,Logitech K250 Compact Bluetooth® Wireless Keyboard – Graphite,mouse,4300.0,https://zahcomputers.pk/product/logitech-k250-compact-bluetooth-wireless-keyboard-graphite/
zahcomputers,Logitech,Logitech G Pro X Superlight 2 SE Wireless Gaming Mouse  – Black 910-007649,mouse,31500.0,https://zahcomputers.pk/product/logitech-g-pro-x-superlight-2-se-gaming-mouse-black/
zahcomputers,Logitech,Logitech G502 X Lightspeed Wireless Gaming Mouse with Hero 25K Sensor – Black 910-006182,mouse,33000.0,https://zahcomputers.pk/product/logitech-g502-x-lightspeed-wireless-gaming-mouse-with-hero-25k-sensor-black-910-006182/
zahcomputers,Logitech,Logitech Pebble Wireless Mouse M350 (Lavender Lemonade),mouse,5000.0,https://zahcomputers.pk/product/logitech-pebble-wireless-mouse-m350-lavender-lemonade/
zahcomputers,Corsair,Corsair Ironclaw RGB Wireless Gaming Mouse,mouse,23999.0,https://zahcomputers.pk/product/corsair-ironclaw-rgb-wireless-gaming-mouse-2/
zahcomputers,Thermaltake,Thermaltake Challenger Keyboard Mouse Combo,mouse,5999.0,https://zahcomputers.pk/product/thermaltake-challenger-keyboard-mouse-combo/
zahcomputers,Thermaltake,Thermaltake Commander Combo V2 Keyboard Mouse,mouse,7099.0,https://zahcomputers.pk/product/thermaltake-commander-combo-v2-keyboard-mouse/
zahcomputers,HyperX,HyperX Pulsefire Saga Pro Wireless Gaming Mouse – Black,mouse,25500.0,https://zahcomputers.pk/product/hyperx-pulsefire-saga-pro-wireless-gaming-mouse-black/
zahcomputers,HyperX,HyperX Pulsefire Haste 2 Pro 4K Wireless Gaming Mouse – Slate Gray,mouse,24800.0,https://zahcomputers.pk/product/hyperx-pulsefire-haste-2-pro-4k-wireless-gaming-mouse-slate-gray/
zahcomputers,HyperX,HyperX Pulsefire Haste 2 Core Wireless Gaming Mouse – White,mouse,13400.0,https://zahcomputers.pk/product/hyperx-pulsefire-haste-2-core-wireless-gaming-mouse-white/
zahcomputers,HyperX,HyperX Pulsefire Haste 2 Core Wireless Gaming Mouse – Black,mouse,13400.0,https://zahcomputers.pk/product/hyperx-pulsefire-haste-2-core-wireless-gaming-mouse-black/
zahcomputers,HyperX,HyperX Pulsefire Haste 2 Wireless Gaming Mouse Black,mouse,23999.0,https://zahcomputers.pk/product/hyperx-pulsefire-haste-2-wireless-gaming-mouse-black/
zahcomputers,HyperX,HyperX Pulsefire Fuse Wireless Gaming Mouse Black,mouse,13999.0,https://zahcomputers.pk/product/hyperx-pulsefire-fuse-wireless-gaming-mouse-black/
zahcomputers,HyperX,HyperX Pulsefire Saga Gaming Mouse Black,mouse,17999.0,https://zahcomputers.pk/product/hyperx-pulsefire-saga-gaming-mouse-black/
zahcomputers,SteelSeries,SteelSeries Rival 3 Wireless Gen 2 Gaming Mouse 2.4GHz and Bluetooth 18000 DPI TrueMove Air Optical Sensor 60 Million Click Durability Light-Weight 100% PTFE Feet Black,mouse,17000.0,https://zahcomputers.pk/product/steelseries-rival-3-gen-2-wireless-gaming-mouse-black/
zahcomputers,SteelSeries,SteelSeries Rival 3 Gen 2 RGB Gaming Mouse 8500 DPI TrueMove Core Optical Sensor 60 Million Click Durability Low Latency 77g Lightweight 100% PTFE Feet RGB Black,mouse,11500.0,https://zahcomputers.pk/product/steelseries-rival-3-gen-2-rgb-gaming-mouse-black/
zahcomputers,Logitech,Logitech G304 LIGHTSPEED Wireless Gaming Mouse – White – 910-005294,mouse,13500.0,https://zahcomputers.pk/product/logitech-g304-lightspeed-wireless-gaming-mouse-white-910-005294/
zahcomputers,Logitech,Logitech M705 Marathon Wireless Mouse Gaming Mouse Wireless 2.4 GHz USB Receiver 5-Programmable Buttons 3-Year Battery PC Mac Laptop Chromebook – Black,mouse,13990.0,https://zahcomputers.pk/product/logitech-m705-marathon-wireless-mouse-gaming-mouse-wireless-2-4-ghz-usb-receiver-5-programmable-buttons-3-year-battery-pc-mac-laptop-chromebook-black/
zahcomputers,Mchose,Mchose A7 Pro Lightweight Wireless Gaming Mouse Black,mouse,15800.0,https://zahcomputers.pk/product/mchosea7-pro-lightweight-wireless-gaming-mouse-black/
zahcomputers,Logitech,Logitech G304 LIGHTSPEED Wireless Gaming Mouse – Black – 910-005286,mouse,13500.0,https://zahcomputers.pk/product/logitech-g304-lightspeed-wireless-gaming-mouse-black-910-005286/
zahcomputers,Ease,Ease EM140 Wired Optical Mouse,mouse,750.0,https://zahcomputers.pk/product/ease-em140-wired-optical-mouse/
zahcomputers,Ease,Ease EM120 Wired Optical Mouse,mouse,690.0,https://zahcomputers.pk/product/ease-em120-wired-optical-mouse/
zahcomputers,Mchose,Mchose A5 Pro Max 4K Wireless Gaming Mouse Black,mouse,14000.0,https://zahcomputers.pk/product/mchose-a5-pro-max-4k-wireless-gaming-mouse-black/
zahcomputers,Logitech,Logitech G PRO X SUPERLIGHT 2 DEX LIGHTSPEED Wireless Gaming Mouse – Black 910-007359,mouse,39000.0,https://zahcomputers.pk/product/logitech-g-pro-x-superlight-2-dex-lightspeed-wireless-gaming-mouse-black-910-007359/
zahcomputers,UGREEN,UGREEN 45792 Thumb Wheel & Side Scrolling Multi-Mode Wireless Bluetooth Mouse,mouse,5500.0,https://zahcomputers.pk/product/ugreen-45792-thumb-wheel-side-scrolling-multi-mode-wireless-bluetooth-mouse/
zahcomputers,Amaze,Amaze A720 Probus Triple Connection Rechargeable Wireless Mouse,mouse,3650.0,https://zahcomputers.pk/product/amaze-a720-probus-triple-connection-rechargeable-wireless-mouse/
zahcomputers,Logitech,Logitech MK250 Compact Bluetooth Wireless Combo – Black,mouse,6300.0,https://zahcomputers.pk/product/logitech-mk250-compact-bluetooth-wireless-combo-black/
zahcomputers,ATTACK,ATTACK SHARK V5 Ultra-Light Tri-Mode Gaming Mouse – White,mouse,18000.0,https://zahcomputers.pk/product/attack-shark-v5-ultra-light-tri-mode-gaming-mouse-white/
zahcomputers,ATTACK,ATTACK SHARK V5 Ultra-Light Tri-Mode Gaming Mouse – Black,mouse,18000.0,https://zahcomputers.pk/product/attack-shark-v5-ultra-light-tri-mode-gaming-mouse-black/
zahcomputers,ATTACK,ATTACK SHARK X8 SE Series Tri-mode Lightweight Wireless Gaming Mouse – White,mouse,6500.0,https://zahcomputers.pk/product/attack-shark-x8-se-series-tri-mode-lightweight-wireless-gaming-mouse-white/
zahcomputers,ATTACK,ATTACK SHARK X8 SE Series Tri-mode Lightweight Wireless Gaming Mouse – Black,mouse,6500.0,https://zahcomputers.pk/product/attack-shark-x8-se-series-tri-mode-lightweight-wireless-gaming-mouse-black/
zahcomputers,Logitech,"Logitech G304 LIGHTSPEED Wireless Gaming Mouse HERO Sensor 200-12,000 DPI, 6 Buttons Blue",mouse,13500.0,https://zahcomputers.pk/product/logitech-g304-lightspeed-wireless-gaming-mouse-hero-sensor-200-12000-dpi-6-buttons-blue/
zahcomputers,Redragon,Redragon BM-4049 Wired Mouse 1200 Dpi (Black),mouse,1500.0,https://zahcomputers.pk/product/redragon-bm-4049-wired-mouse-1200-dpi-black/
zahcomputers,ATK,ATK Dragonfly A9 Pro Lightweight Wireless Gaming Mouse – White,mouse,16000.0,https://zahcomputers.pk/product/atk-dragonfly-a9-pro-lightweight-wireless-gaming-mouse-white/
zahcomputers,AULA,AULA F813 Pro Wired Gaming Mouse Full color Breathing Optical Ergonomic Gaming Mice Ergonomic Design Computer Mouse for Windows PC Gamers,mouse,3550.0,https://zahcomputers.pk/product/aula-f813pro-wired-gaming-mouse/
zahcomputers,Amaze,Amaze A702 Zoom Probus Silent Click Wired Mouse,mouse,1450.0,https://zahcomputers.pk/product/amaze-a702-zoom-probus-silent-click-wired-mouse/
zahcomputers,Amaze,Amaze A745 Probus Palm Comfort Wireless Keyboard & Mouse Combo,mouse,6180.0,https://zahcomputers.pk/product/amaze-a745-probus-palm-comfort-wireless-keyboard-mouse-combo/
zahcomputers,Amaze,Amaze A744 Probus Palm Comfort Silent Wireless Keyboard & Mouse Combo,mouse,6180.0,https://zahcomputers.pk/product/amaze-a744-probus-palm-comfort-silent-wireless-keyboard-mouse-combo/
zahcomputers,Amaze,Amaze A742 Probus Super Silent Wireless Keyboard & Mouse Combo,mouse,5650.0,https://zahcomputers.pk/product/amaze-a742-probus-super-silent-wireless-keyboard-mouse-combo/
zahcomputers,Amaze,Amaze A725 Probus Triple Connection Rechargeable Wireless Mouse,mouse,4150.0,https://zahcomputers.pk/product/amaze-a725-probus-triple-connection-rechargeable-wireless-mouse/
zahcomputers,Amaze,Amaze A715 Probus Comfort Click Wireless Mouse,mouse,2950.0,https://zahcomputers.pk/product/amaze-a715-probus-comfort-click-wireless-mouse/
zahcomputers,Amaze,Amaze A712 Clicket Dual Wireless Rechargeable Mouse – Gray,mouse,2600.0,https://zahcomputers.pk/product/amaze-a712-clicket-dual-wireless-rechargeable-mouse-white/
zahcomputers,Amaze,Amaze A712 Clicket Dual Wireless Rechargeable Mouse – Black,mouse,2600.0,https://zahcomputers.pk/product/amaze-a712-clicket-dual-wireless-rechargeable-mouse-black/
zahcomputers,Amaze,Amaze A710 Clicket Dual Wireless Mouse – White,mouse,2400.0,https://zahcomputers.pk/product/amaze-a710-clicket-dual-wireless-mouse-white/
zahcomputers,Amaze,Amaze A710 Clicket Dual Wireless Mouse – Balck,mouse,2400.0,https://zahcomputers.pk/product/amaze-a710-clicket-dual-wireless-mouse-balck/
zahcomputers,Amaze,Amaze A704 Probus Series Silent Touch Wired Mouse,mouse,1450.0,https://zahcomputers.pk/product/amaze-a704-probus-series-silent-touch-wired-mouse/
zahcomputers,ATTACK,ATTACK SHARK X5 Wireless Gaming Mouse White,mouse,4500.0,https://zahcomputers.pk/product/attack-shark-x5-wireless-gaming-mouse-white/
zahcomputers,ATTACK,ATTACK SHARK G3PRO Tri-mode Wireless Gaming Mouse with Charge Dock 25000 DPI Ultra Lightweight White,mouse,7300.0,https://zahcomputers.pk/product/attack-shark-g3pro-tri-mode-wireless-gaming-mouse-with-charge-dock-25000-dpi-ultra-lightweight-white/
zahcomputers,ATTACK,ATTACK SHARK G3PRO Tri-mode Wireless Gaming Mouse with Charge Dock 25000 DPI Ultra Lightweight Black,mouse,7300.0,https://zahcomputers.pk/product/attack-shark-g3pro-tri-mode-wireless-gaming-mouse-with-charge-dock-25000-dpi-ultra-lightweight-balck/
zahcomputers,ATTACK,ATTACK SHARK X11 SE Wireless Gaming Mouse Black,mouse,6500.0,https://zahcomputers.pk/product/attack-shark-x11-se-wireless-gaming-mouse-black/
zahcomputers,ATTACK,ATTACK SHARK X11 SE Wireless Gaming Mouse White,mouse,6500.0,https://zahcomputers.pk/product/attack-shark-x11-se-wireless-gaming-mouse-white/
zahcomputers,Attack,Attack Shark R3 46g Superlight Magnesium Alloy Wireless Gaming Mouse White,mouse,19500.0,https://zahcomputers.pk/product/attack-shark-r3-46g-superlight-magnesium-alloy-wireless-gaming-mouse-white/
zahcomputers,ASUS,ASUS P718 ROG Harpe Ace Extreme Gaming Mouse,mouse,68299.0,https://zahcomputers.pk/product/asus-p718-rog-harpe-ace-extreme-gaming-mouse/
zahcomputers,Logitech,Logitech MX Anywhere 3S Compact Wireless Mouse – Graphite,mouse,23000.0,https://zahcomputers.pk/product/logitech-mx-anywhere-3s-compact-wireless-mouse-graphite/
zahcomputers,Razer,Razer Basilisk V3 Pro 35K Ergonomic Wireless Gaming Mouse,mouse,65000.0,https://zahcomputers.pk/product/razer-basilisk-v3-pro-35k-ergonomic-wireless-gaming-mouse/
zahcomputers,Razer,Razer Viper V3 Pro Wireless Esports Gaming Mouse – Black,mouse,65000.0,https://zahcomputers.pk/product/razer-viper-v3-pro-wireless-esports-gaming-mouse-black/
zahcomputers,Razer,Razer Viper V3 Pro Wireless Esports Gaming Mouse – White,mouse,65000.0,https://zahcomputers.pk/product/razer-viper-v3-pro-wireless-esports-gaming-mouse-white/
zahcomputers,Razer,Razer Orochi V2 Wireless Optical Gaming Mouse – Quartz Edidtion,mouse,18000.0,https://zahcomputers.pk/product/razer-orochi-v2-wireless-optical-gaming-mouse-quartz-edidtion/
zahcomputers,ATK,"ATK VXE Dragonfly R1 Pro White Wireless Gaming Mouse, Lightweight 1.7 oz 48 g, Equipped with Pixart PAW3395, Up to 75 Hours, Cooling Coating, 4K Polling Rate",mouse,15000.0,https://zahcomputers.pk/product/atk-vxe-dragonfly-r1-pro-white-wireless-gaming-mouse-lightweight-1-7-oz-48-g-equipped-with-pixart-paw3395-up-to-75-hours-cooling-coating-4k-polling-rate/
zahcomputers,ATK,"ATK VXE Dragonfly R1 Pro Black Wireless Gaming Mouse, Lightweight 1.7 oz 48 g, Equipped with Pixart PAW3395, Up to 75 Hours, Cooling Coating, 4K Polling Rate",mouse,15000.0,https://zahcomputers.pk/product/atk-vxe-dragonfly-r1-pro-black-wireless-gaming-mouse-lightweight-1-7-oz-48-g-equipped-with-pixart-paw3395-up-to-75-hours-cooling-coating-4k-polling-rate/
zahcomputers,ATK,"ATK VXE Dragonfly R1 SE+ White Wireless Gaming Mouse, Lightweight, 2.0 oz 55 g, Pixart PAW3395 SE Equipped with Up to 70 Hours, Wireless Wired Compatible",mouse,8000.0,https://zahcomputers.pk/product/atk-vxe-dragonfly-r1-se-white-wireless-lightweight-gaming-mouse/
zahcomputers,ATK,"ATK VXE Dragonfly R1 SE+ Black Wireless Gaming Mouse, Lightweight, 2.0 oz 55 g, Pixart PAW3395 SE Equipped with Up to 70 Hours, Wireless Wired Compatible",mouse,8000.0,https://zahcomputers.pk/product/atk-vxe-dragonfly-r1-se-black-wireless-lightweight-gaming-mouse/
zahcomputers,Corsair,Corsair HARPOON RGB WIRELESS Gaming Mouse (AP),mouse,16000.0,https://zahcomputers.pk/product/corsair-harpoon-rgb-wireless-gaming-mouse-ap/
zahcomputers,Corsair,Corsair M55 WIRELESS Gaming Mouse (AP),mouse,14900.0,https://zahcomputers.pk/product/m55-wireless-gaming-mouse-ap/
zahcomputers,Corsair,Corsair M55 Lightweight Gaming Mouse (AP),mouse,10200.0,https://zahcomputers.pk/product/corsair-m55-lightweight-gaming-mouse-ap/
zahcomputers,Corsair,Corsair M75 AIR WIRELESS Ultra-Lightweight Gaming Mouse – Black,mouse,27750.0,https://zahcomputers.pk/product/corsair-m75-air-wireless-ultra-lightweight-gaming-mouse-black/
zahcomputers,Corsair,Corsair KATAR PRO Ultra-Light Gaming Mouse (AP),mouse,6200.0,https://zahcomputers.pk/product/corsair-katar-pro-ultra-light-gaming-mouse-ap/
zahcomputers,ASUS,ASUS P716 ROG Harpe Ace Mini Wireless Gaming Mouse,mouse,34699.0,https://zahcomputers.pk/product/asus-p716-rog-harpe-ace-mini-wireless-gaming-mouse/
zahcomputers,ASUS,ASUS P714 ROG Keris II Ace Wireless Gaming Mouse,mouse,32699.0,https://zahcomputers.pk/product/asus-p714-rog-keris-ii-ace-wireless-gaming-mouse/
zahcomputers,Logitech,Logitech G102 LightSync 2nd Edition Gaming Mouse White 910-005803,mouse,4850.0,https://zahcomputers.pk/product/logitech-g102-lightsync-2nd-edition-gaming-mouse-white-910-005803/
zahcomputers,Logitech,Logitech Signature M650 Mouse white 910-006264,mouse,7500.0,https://zahcomputers.pk/product/logitech-signature-m650-mouse-graphite-910-006264/
zahcomputers,Logitech,Logitech SIGNATURE M550 Comfort-Fit Wireless Mouse – 910-007190,mouse,6500.0,https://zahcomputers.pk/product/logitech-signature-m550-comfort-fit-wireless-mouse-910-007190/
zahcomputers,Logitech,Logitech Pebble 2 Wireless Mouse M350S (Grey)  910-006988,mouse,5100.0,https://zahcomputers.pk/product/logitech-pebble-2-wireless-mouse-m350s-grey-910-006988/
zahcomputers,Logitech,Logitech POP MOUSE Wireless Mouse Lilac – 910-007403,mouse,6600.0,https://zahcomputers.pk/product/logitech-pop-mouse-wireless-mouse-lilac-910-007403/
zahcomputers,Logitech,Logitech POP MOUSE Wireless Mouse Rose – 910-007402,mouse,6600.0,https://zahcomputers.pk/product/logitech-pop-mouse-wireless-mouse-black-910-007402/
zahcomputers,Logitech,Logitech POP MOUSE Wireless Mouse white –  910-007400,mouse,6600.0,https://zahcomputers.pk/product/logitech-pop-mouse-wireless-mouse-black-910-007400/
zahcomputers,Logitech,Logitech POP MOUSE Wireless Mouse Black – 910-007401,mouse,7200.0,https://zahcomputers.pk/product/logitech-pop-mouse-wireless-mouse-black-910-007401/
zahcomputers,Logitech,Logitech M275 Wireless Mouse – Black – 910-004587,mouse,3950.0,https://zahcomputers.pk/product/logitech-m275-wireless-mouse-black-910-004587/
zahcomputers,Logitech,Logitech M235 Wireless Mouse Red 910-003412,mouse,3400.0,https://zahcomputers.pk/product/logitech-m235-wireless-mouse-red-910-003412/
zahcomputers,Logitech,Logitech M196 Bluetooth Mouse White – 910-007463,mouse,2750.0,https://zahcomputers.pk/product/logitech-m196-bluetooth-mouse-white-910-007463/
zahcomputers,Logitech,Logitech R500 Laser Presentation Remote – Grey 910-005389,mouse,12500.0,https://zahcomputers.pk/product/logitech-r500-laser-presentation-remote-grey-910-005389/
zahcomputers,ATTACK,ATTACK SHARK  C01 Coiled Cable Gray,mouse,3000.0,https://zahcomputers.pk/product/attack-shark-c01-coiled-cable-gray/
zahcomputers,ATTACK,ATTACK SHARK  C01 Coiled Cable White,mouse,3000.0,https://zahcomputers.pk/product/attack-shark-c01-coiled-cable/
zahcomputers,ATTACK,ATTACK SHARK X3MAX PAW3950 Wireless Gaming Mouse Black,mouse,11000.0,https://zahcomputers.pk/product/attack-shark-x3max-paw3950-wireless-gaming-mouse-black/
zahcomputers,ATTACK,ATTACK SHARK X3MAX PAW3950 Wireless Gaming Mouse White,mouse,11000.0,https://zahcomputers.pk/product/attack-shark-x3max-paw3950-wireless-gaming-mouse-white/
zahcomputers,ATTACK,ATTACK SHARK R5 Ultra Carbon Fiber Wireless 8K PAW3950MAX Gaming Mouse Black,mouse,18000.0,https://zahcomputers.pk/product/attack-shark-r5-ultra-carbon-fiber-wireless-8k-paw3950max-gaming-mouse-black/
zahcomputers,ATTACK,ATTACK SHARK R5 Ultra Carbon Fiber Wireless 8K PAW3950MAX Gaming Mouse White,mouse,18000.0,https://zahcomputers.pk/product/attack-shark-r5-ultra-carbon-fiber-wireless-8k-paw3950max-gaming-mouse/
zahcomputers,Logitech,Logitech M90 Optical USB Mouse (Black),mouse,1450.0,https://zahcomputers.pk/product/logitech-m90-optical-usb-mouse-black/
zahcomputers,UGREEN,"UGREEN 45012 2.4G Wireless Mouse for Laptop, 1600 DPI Optical Tracking",mouse,1650.0,https://zahcomputers.pk/product/ugreen-45012-2-4g-wireless-mouse-for-laptop-1600-dpi-optical-tracking/
zahcomputers,UGREEN,UGREEN 15807 MU101 Ergonomic Wireless Mouse – Blue,mouse,2500.0,https://zahcomputers.pk/product/ugreen-15807-mu101-ergonomic-wireless-mouse-blue/
zahcomputers,UGREEN,UGREEN 15805 2.4G Bluetooth Wireless Mouse White,mouse,2500.0,https://zahcomputers.pk/product/ugreen-15805-2-4g-bluetooth-wireless-mouse-white/
zahcomputers,UGREEN,UGREEN 90395 Ergonomic Bt & W/L Mouse Black,mouse,2500.0,https://zahcomputers.pk/product/ugreen-90395-ergonomic-bt-w-l-mouse-black/
zahcomputers,UGREEN,UGREEN MU006 (25752) Ergonomic Wireless Mouse,mouse,2500.0,https://zahcomputers.pk/product/ugreen-mu006-25752-ergonomic-wireless-mouse/
zahcomputers,UGREEN,UGREEN 90374 Wireless Mouse – Green,mouse,2500.0,https://zahcomputers.pk/product/ugreen-90374-wireless-mouse-green/
zahcomputers,UGREEN,UGREEN 90373 Portable Wireless Mouse,mouse,2500.0,https://zahcomputers.pk/product/ugreen-90373-portable-wireless-mouse/
zahcomputers,Glorious,"Glorious Model D Pro Flamingo Wireless Gaming Mouse, Limited Edition, Forge, Pink",mouse,12500.0,https://zahcomputers.pk/product/glorious-model-d-pro-flamingo-wireless-gaming-mouse-limited-edition-forge-pink/
zahcomputers,Logitech,Logitech M196 Bluetooth Mouse – 910-007462,mouse,2750.0,https://zahcomputers.pk/product/logitech-m196-bluetooth-mouse-910-007462/
zahcomputers,A4Tech,"A4Tech G3-330NS Wireless Mouse 1200 DPI, Silent Clicks",mouse,1999.0,https://zahcomputers.pk/product/a4tech-g3-330ns-wireless-mouse-1200-dpi-silent-clicks/
zahcomputers,A4Tech,A4Tech G3-300NS 2.4G Optical Wireless Mouse – Silent Clicks | Black,mouse,1999.0,https://zahcomputers.pk/product/a4tech-g3-300ns-2-4g-optical-wireless-mouse-silent-clicks-black/
zahcomputers,A4Tech,"A4Tech G3-280NS 2.4G Optical Wireless Mouse, Silent Clicks, Glossy Grey",mouse,1999.0,https://zahcomputers.pk/product/a4tech-g3-280ns-2-4g-optical-wireless-mouse-silent-clicks-glossy-grey/
zahcomputers,A4Tech,A4Tech G3-200NS Wireless Mouse,mouse,2000.0,https://zahcomputers.pk/product/a4tech-g3-200ns-wireless-mouse/
zahcomputers,A4Tech,A4Tech G7-810S Air2 | 2.4G Wireless Mouse – Black,mouse,2799.0,https://zahcomputers.pk/product/a4tech-g7-810-air2-2-4g-wireless-mouse-black/
zahcomputers,A4Tech,A4Tech FG45CS Air 2.4G Wireless Mouse 2000 DPI | Sports Red,mouse,3200.0,https://zahcomputers.pk/product/a4tech-fg45cs-air-2-4g-wireless-mouse-2000-dpi-sports-red/
zahcomputers,A4Tech,A4Tech FG45CS Air 2.4G Wireless Mouse 2000 DPI | Stone Grey,mouse,3200.0,https://zahcomputers.pk/product/a4tech-fg45cs-air-2-4g-wireless-mouse-2000-dpi-stone-grey/
zahcomputers,A4tech,A4tech Fstyler FG20S Silent Click Wireless Mouse (White),mouse,2399.0,https://zahcomputers.pk/product/a4tech-fstyler-fg20s-silent-click-wireless-mouse-white/
zahcomputers,A4tech,A4tech Fstyler FG20S Silent Click Wireless Mouse (Grey),mouse,2399.0,https://zahcomputers.pk/product/a4tech-fstyler-fg20s-silent-click-wireless-mouse-grey/
zahcomputers,A4Tech,A4Tech FG16CS Air2 Dual-Function Air Mouse Black 2000dpi Silent Clicks,mouse,3000.0,https://zahcomputers.pk/product/a4tech-fg16cs-air2-dual-function-air-mouse-black-2000dpi-silent-clicks/
zahcomputers,A4tech,A4tech Fstyler FG12S 1200 DPI Optical Wireless Mouse | Panda,mouse,2099.0,https://zahcomputers.pk/product/a4tech-fstyler-fg12s-1200-dpi-optical-wireless-mouse-panda/
zahcomputers,A4tech,A4tech Fstyler FG12S 1200 DPI Optical Wireless Mouse | White,mouse,2099.0,https://zahcomputers.pk/product/a4tech-fstyler-fg12s-1200-dpi-optical-wireless-mouse-white/
zahcomputers,A4Tech,A4Tech Fstyler FG10S 2.4G Wireless Mouse – Grey,mouse,2400.0,https://zahcomputers.pk/product/a4tech-fstyler-fg10s-2-4g-wireless-mouse-grey/
zahcomputers,A4Tech,A4Tech FB12S Dual Mode Wireless Mouse | Black,mouse,2500.0,https://zahcomputers.pk/product/a4tech-fb12s-dual-mode-wireless-mouse-black/
zahcomputers,A4Tech,A4Tech FB20S Fstyler Dual Mode Wireless Mouse | Smoky Grey,mouse,2999.0,https://zahcomputers.pk/product/a4tech-fb20s-fstyler-dual-mode-wireless-mouse-smoky-grey/
zahcomputers,A4Tech,A4Tech FB26CS Air2 Bluetooth and 2.4G Wireless Mouse | Smoky Grey,mouse,3500.0,https://zahcomputers.pk/product/a4tech-fb26cs-air2-bluetooth-and-2-4g-wireless-mouse-smoky-grey/
zahcomputers,A4Tech,A4Tech N-530S Illuminate Mouse 1200 DPI Black,mouse,1699.0,https://zahcomputers.pk/product/a4tech-n-530-illuminate-mouse-1200-dpi-black/
zahcomputers,A4Tech,A4Tech OP-620D Wired Mouse – Black,mouse,1400.0,https://zahcomputers.pk/product/a4tech-op-620d-wired-mouse-black/
zahcomputers,A4Tech,A4Tech Fstyler FM45S Air Dual-Function Air Mouse PC | Mac – Stone Grey,mouse,2500.0,https://zahcomputers.pk/product/a4tech-fstyler-fm45s-air-dual-function-air-mouse-pc-mac-stone-grey/
zahcomputers,Razer,Razer Cobra Pro Compact Wireless Gaming Mouse,mouse,50000.0,https://zahcomputers.pk/product/razer-cobra-pro-compact-wireless-gaming-mouse/
