retailer,manufacturer,product_name,category,price,url
techmatched,Buy,Buy ZOTAC GAMING GeForce RTX 5080 AMP Extreme INFINITY GPU in Pakistan | TechMatched,gpu,435000.0,https://techmatched.pk/product/buy-zotac-gaming-geforce-rtx-5080-amp-gpu/
techmatched,Buy,Buy Gigabyte GeForce RTX 5080 Windforce OC SFF 16GB Graphics Card in Pakistan | TechMatched,gpu,420000.0,https://techmatched.pk/product/buy-gigabyte-rtx-5080-windforce-oc-sff-gpu/
techmatched,Buy,Buy ZOTAC Gaming GeForce RTX 5080 Solid Core OC Edition GPU in Pakistan | TechMatched,gpu,420000.0,https://techmatched.pk/product/buy-zotac-rtx-5080-solid-core-oc-gpu-in-pak/
techmatched,Buy,Buy ZOTAC GAMING GeForce RTX 5070 Ti AMP Extreme INFINITY GPU in Pakistan | TechMatched,gpu,350000.0,https://techmatched.pk/product/buy-zotac-gaming-geforce-rtx-5070ti-amp-gpu/
techmatched,Buy,Buy Gigabyte GeForce RTX 5070 Ti WINDFORCE OC SFF 16G Graphics Card in Pakistan | TechMatched,gpu,349500.0,https://techmatched.pk/product/gigabyte-geforce-rtx-5070ti-windforce-oc/
techmatched,Buy,Buy Sapphire NITRO+ AMD Radeon RX 9070 XT OC Graphics Card in Pakistan | TechMatched,gpu,280000.0,https://techmatched.pk/product/sapphire-nitro-amd-radeon-rx-9070-xt-oc/
techmatched,Buy,Buy Gigabyte Radeon RX 9070 XT Gaming 16GB Graphics Card in Pakistan | TechMatched,gpu,270000.0,https://techmatched.pk/product/gigabyte-radeon-rx-9070-xt-gaming-16g-gpu/
techmatched,Buy,Buy Sapphire Pulse RX 9070 XT Gaming GPU in Pakistan | TechMatched,gpu,260000.0,https://techmatched.pk/product/buy-sapphire-pulse-rx-9070-xt-gaming-gpu/
techmatched,Buy,Buy Gigabyte GeForce RTX 5070 WINDFORCE SFF 12G Graphics Card in Pakistan | TechMatched,gpu,230000.0,https://techmatched.pk/product/buy-gigabyte-rtx-5070-windforce-sff-12gb-in-pak-tm/
techmatched,Buy,Buy Asus Dual Radeon RX 9060 XT 16GB Graphics Card in Pakistan | TechMatched,gpu,185000.0,https://techmatched.pk/product/asus-dual-rx-9060-xt-16gb-gddr6-gpu-in-pak/
techmatched,Buy,Buy Sapphire Pulse AMD Radeon RX 9060 XT Gaming OC 16GB Graphics Card in Pakistan | TechMatched,gpu,175000.0,https://techmatched.pk/product/sapphire-pulse-rx-9060-xt-gaming-oc-gpu/
techmatched,Buy,Buy PNY GeForce RTX 5060 Ti 16GB Dual Fan OC Graphics Card in Pakistan | TechMatched,gpu,175000.0,https://techmatched.pk/product/buy-pny-rtx-5060-ti-16gb-dual-fan-oc-gpu/
techmatched,Buy,Buy Asus Tuff RTX 5060 8GB Graphics Card in Pakistan | TechMatched,gpu,130000.0,https://techmatched.pk/product/buy-asus-tuff-rtx-5060-graphics-card-in-pak-tm/
techmatched,Buy,Buy Asus Dual RTX 5060 8GB Graphics Card in Pakistan | TechMatched,gpu,120000.0,https://techmatched.pk/product/buy-asus-dual-rtx-5060-8gb-graphics-card-in-pak-tm/
techmatched,Buy,Buy PNY NVIDIA GeForce RTX 5060 8GB Dual Fan OC GPU in Pakistan | TechMatched,gpu,115000.0,https://techmatched.pk/product/buy-pny-nvidia-geforce-rtx-5060-8gb-dual-fan-oc-gpu-in-pak-tm/
techmatched,Buy,Buy ZOTAC GAMING GeForce RTX 5060 Twin Edge OC 8GB Graphics Card in Pakistan | TechMatched,gpu,115000.0,https://techmatched.pk/product/zotac-rtx-5060-twin-edge-oc-8gb-gpu-in-pak/
techmatched,Buy,Buy PNY NVIDIA GeForce RTX 5060 8GB Dual Fan GPU in Pakistan | TechMatched,gpu,115000.0,https://techmatched.pk/product/buy-pny-rtx-5060-8gb-dual-fan-gpu-in-pak-tm/
techmatched,Buy,Buy ASRock AMD Radeon RX 9060 XT Challenger 8GB OC Graphics Card in Pakistan | TechMatched,gpu,113000.0,https://techmatched.pk/product/asrock-amd-radeon-rx-9060-xt-challenger-8gb/
techmatched,Buy,Buy Zotac Gaming GeForce RTX 5050 Twin Edge 8GB Graphics Card in Pakistan | TechMatched,gpu,99000.0,https://techmatched.pk/product/zotac-gaming-rtx-5050-twin-edge-8gb-gpu/
techmatched,Buy,Buy MSI GeForce RTX 3050 VENTUS 2X XS 8G OC Graphic card in Pakistan | TechMatched,gpu,82000.0,https://techmatched.pk/product/buy-msi-geforce-gtx-3050-ventus-2x-xs-8gb/
techmatched,Buy,Buy MSI GeForce RTX 3050 Ventus 2X E 6GB OC Graphics Card in Pakistan | TechMatched,gpu,72000.0,https://techmatched.pk/product/buy-msi-geforce-rtx-3050-ventus-2x-e-6gb-oc/
techmatched,Buy,Buy MSI GTX 1660 Super Used GPU in Pakistan | TechMatched,gpu,46000.0,https://techmatched.pk/product/buy-msi-gtx-1660s-used-gpu-in-pakistan-tm/
techmatched,Buy,Buy Asus ROG Herculx GPU Holder in Pakistan | TechMatched,gpu,15000.0,https://techmatched.pk/product/buy-asus-rog-herculx-gpu-holder-pakistan-tm/
