retailer,manufacturer,product_name,category,price,url
techmatched,Buy,Buy ASUS ROG KERIS II Wireless ACE Mouse in Pakistan | TechMatched,mouse,33000.0,https://techmatched.pk/product/buy-asus-rog-keris-ii-wireless-ace-in-pk-tm/
techmatched,Buy,Buy ASUS ROG KERIS II ACE WIRELESS BLACK Gaming Mouse in Pakistan | TechMatched,mouse,33000.0,https://techmatched.pk/product/buy-asus-rog-keris-ii-ace-gaming-mouse/
techmatched,Buy,Buy ASUS ROG Harpe Ace Aim Lab Edition Wireless Gaming Mouse in Pakistan | TechMatched,mouse,29500.0,https://techmatched.pk/product/buy-asus-rog-harpe-ace-aim-lab-mouse-tm/
techmatched,Buy,Buy LOGITECH G Pro 2 Lightspeed Wireless Mouse – Black in Pakistan | TechMatched,mouse,28500.0,https://techmatched.pk/product/buy-logitech-g-pro-2-lightspeed-mouse-tm-2/
techmatched,Buy,Buy MSI Clutch GM51 Lightweight Wireless Gaming Mouse in Pakistan | TechMatched,mouse,23000.0,https://techmatched.pk/product/buy-msi-clutch-gm51-lightweight-mouse-tm/
techmatched,Buy,Buy ASUS ROG KERIS Wireless AimPoint Gaming Mouse in Pakistan | TechMatched,mouse,20000.0,https://techmatched.pk/product/buy-asus-rog-keris-aimpoint-gaming-mouse-tm/
techmatched,Buy,Buy Attack Shark R5 Ultra Black Wireless Gaming Mouse in Pakistan | TechMatched,mouse,19000.0,https://techmatched.pk/product/buy-attack-shark-r5-ultra-gaming-mouse/
techmatched,Buy,Buy Logitech G502x Gaming Mouse White in Pakistan | TechMatched,mouse,17500.0,https://techmatched.pk/product/buy-logitech-g502x-gaming-mouse-white-in-pk-tm/
techmatched,Buy,Buy Logitech G502x Gaming Mouse Black in Pakistan | TechMatched,mouse,17500.0,https://techmatched.pk/product/buy-logitech-g502x-gaming-mouse-black-pk-tm/
techmatched,Buy,Buy MSI Clutch GM41 Lightweight V2 Gaming Mouse in Pakistan | TechMatched,mouse,16800.0,https://techmatched.pk/product/buy-msi-clutch-gm41-lightweight-v2-mouse-tm/
techmatched,Buy,Buy ATK VXE Dragonfly R1 Pro Wireless Gaming Mouse in Pakistan | TechMatched,mouse,15000.0,https://techmatched.pk/product/buy-atk-vxe-dragonfly-r1-pro-gaming-mouse/
techmatched,Buy,Buy Logitech Lift Vertical Wireless Mouse Pink in Pakistan | TechMatched,mouse,14999.0,https://techmatched.pk/product/buy-logitech-lift-vertical-wireless-mouse-pink-in-pk-tm/
techmatched,Buy,Buy Logitech Lift Vertical Wireless Mouse White in Pakistan | TechMatched,mouse,14999.0,https://techmatched.pk/product/buy-logitech-lift-vertical-mouse-in-pk-tm/
techmatched,Buy,Buy Logitech Lift Vertical Wireless Mouse Gray in Pakistan | TechMatched,mouse,14999.0,https://techmatched.pk/product/buy-logitech-lift-vertical-mouse-in-pk-tm-2/
techmatched,Buy,Buy HyperX Pulsefire Haste 2 Wireless Gaming Mouse in Pakistan | TechMatched,mouse,13000.0,https://techmatched.pk/product/buy-hyperx-pulsefire-haste-2-wireless-mouse/
techmatched,Buy,Buy ATTACK SHARK X3 MAX Wireless Gaming Mouse in Pakistan | TechMatched,mouse,12500.0,https://techmatched.pk/product/buy-attack-shark-x3-max-gaming-mouse-in-pak/
techmatched,Buy,Buy ATTACK SHARK X3 PRO Gaming Mouse in Pakistan | TechMatched,mouse,13500.0,https://techmatched.pk/product/buy-attack-shark-x3-pro-gaming-mouse-in-pk/
techmatched,Buy,Buy ASUS TUF Gaming M4 Wireless Mouse in Pakistan | TechMatched,mouse,12500.0,https://techmatched.pk/product/buy-asus-tuf-gaming-m4-mouse-in-pk-tm/
techmatched,Buy,Buy Ajazz AJ159 PRO Wireless Gaming Mouse in Pakistan | TechMatched,mouse,11000.0,https://techmatched.pk/product/buy-ajazz-aj159-pro-wireless-gaming-mouse/
techmatched,Buy,Buy ATK VXE Dragonfly R1 Wireless Gaming Mouse in Pakistan | TechMatched,mouse,10999.0,https://techmatched.pk/product/buy-atx-vxe-dragonfly-r1-wireless-gaming/
techmatched,Buy,Buy Logitech M575 Ergo Trackball Mouse in Pakistan | TechMatched,mouse,10999.0,https://techmatched.pk/product/buy-logitech-m575-trackball-mouse-in-pk-tm/
techmatched,Buy,Buy ATTACK SHARK X6 Gaming Mouse in Pakistan | TechMatched,mouse,10500.0,https://techmatched.pk/product/buy-attack-shark-x6-gaming-mouse-in-pk-tm/
techmatched,Buy,Buy Attack Shark X3 Mouse White in Pakistan | TechMatched,mouse,9500.0,https://techmatched.pk/product/buy-attack-shark-x3-mouse-white-pakistan-tm/
techmatched,Buy,Buy HyperX Pulsefire Haste 2 Wired Gaming Mouse in Pakistan | TechMatched,mouse,9000.0,https://techmatched.pk/product/buy-hyperx-pulsefire-haste-2-wired-gaming-m/
techmatched,Buy,Buy Logitech M650 L SIGNATURE Bluetooth Wireless Mouse in Pakistan | TechMatched,mouse,7600.0,https://techmatched.pk/product/buy-logitech-m650l-signature-mouse-in-pk-tm/
techmatched,Buy,Buy Corsair Katar Pro Wireless Gaming Mouse in Pakistan | TechMatched,mouse,7500.0,https://techmatched.pk/product/buy-corsair-katar-pro-mouse-in-pakistan-tm/
techmatched,Buy,Buy Logitech MK275 Wireless Combo in Pakistan | TechMatched,mouse,7000.0,https://techmatched.pk/product/buy-logitech-mk275-wireless-combo-in-pk-tm/
techmatched,Buy,Buy Logitech G402 Gaming Mouse Black in Pakistan | TechMatched,mouse,7000.0,https://techmatched.pk/product/buy-logitech-g402-gaming-mouse-black-pk-tm/
techmatched,Buy,Buy Corsair Sabre RGB Pro Wired Gaming Mouse in Pakistan | TechMatched,mouse,7000.0,https://techmatched.pk/product/buy-corsair-sabre-rgb-pro-gaming-mouse/
techmatched,Buy,Buy Razer DeathAdder Essential Gaming Mouse in Pakistan | TechMatched,mouse,7000.0,https://techmatched.pk/product/buy-razer-deathadder-essential-mouse-pak-tm/
techmatched,Buy,Buy Corsair Harpoon RGB Pro Gaming Mouse in Pakistan | TechMatched,mouse,7500.0,https://techmatched.pk/product/buy-corsair-harpoon-rgb-pro-mouse-pak-tm/
techmatched,Buy,Buy MSI Clutch GM11 Gaming Mouse in Pakistan | TechMatched,mouse,5500.0,https://techmatched.pk/product/buy-msi-clutch-gm11-gaming-mouse-in-pak-tm/
techmatched,Buy,Buy ASUS TUF GAMING M3 GEN II Mouse in Pakistan | TechMatched,mouse,5800.0,https://techmatched.pk/product/buy-asus-tuf-gaming-m3-gen-ii-mouse-tm/
techmatched,Buy,Buy FANTECH WG7V2 CRYPTO II Wireless Gaming Mouse in Pakistan | TechMatched,mouse,5499.0,https://techmatched.pk/product/fantech-cypto-ii-wireless-gaming-mouse/
techmatched,Buy,Buy Logitech Pebble 2 M350s Bluetooth Wireless Mouse in Pakistan | TechMatched,mouse,5200.0,https://techmatched.pk/product/buy-logitech-pebble-2-m350s-mouse-in-pak-tm/
techmatched,Buy,Buy Attack Shark X5 Wireless Black Gaming Mouse in Pakistan | TechMatched,mouse,5000.0,https://techmatched.pk/product/attack-shark-x5-wireless-black-mouse-tm/
techmatched,Buy,Buy Logitech M331 Silent Wireless Mouse Red in Pakistan | TechMatched,mouse,4300.0,https://techmatched.pk/product/buy-logitech-m331-wireless-mouse-red-pk-tm/
techmatched,Buy,Buy Logitech M331 Silent Wireless Mouse Blue in Pakistan | TechMatched,mouse,4300.0,https://techmatched.pk/product/buy-logitech-m331-wireles-mouse-black-pk-tm/
techmatched,Buy,Buy Logitech M331 Silent Wireless Mouse Black in Pakistan | TechMatched,mouse,4300.0,https://techmatched.pk/product/buy-logitech-m331-wireless-mouse-in-pk-tm/
techmatched,Buy,Buy Logitech M325s Wireless Mouse Silver in Pakistan | TechMatched,mouse,4250.0,https://techmatched.pk/product/buy-logitech-m325s-mouse-silver-in-pk-tm/
techmatched,Buy,Buy Logitech M325s Wireless Mouse Black in Pakistan | TechMatched,mouse,4250.0,https://techmatched.pk/product/buy-logitech-m325s-mouse-black-in-pk-tm/
techmatched,Buy,Buy Logitech M240 Bluetooth silent Mouse Pink in Pakistan | TechMatched,mouse,4000.0,https://techmatched.pk/product/buy-logitech-m240-mouse-pink-in-pk-tm/
techmatched,Buy,Buy Logitech M240 Bluetooth silent Mouse White in Pakistan | TechMatched,mouse,4000.0,https://techmatched.pk/product/buy-logitech-m240-mouse-white-in-pk-tm/
techmatched,Buy,Buy Zalman M520 Wireless Mouse in Pakistan | TechMatched,mouse,3700.0,https://techmatched.pk/product/buy-zalman-m520-wireless-mouse-in-pakistan/
techmatched,Buy,Buy Logitech M235 Wireless Mouse in Pakistan | TechMatched,mouse,3450.0,https://techmatched.pk/product/buy-logitech-m235-wireless-mouse-in-pak-tm/
techmatched,Buy,Buy Logitech M221 Wireless Mouse Charcoal in Pakistan | TechMatched,mouse,3300.0,https://techmatched.pk/product/buy-logitech-m221-wireless-mouse-charcoal-pk-tm/
techmatched,Buy,Buy Logitech M191 Wireless Mouse  Gray in Pakistan | TechMatched,mouse,3050.0,https://techmatched.pk/product/buy-logitech-m191-wireless-mouse-red-pk-tm/
techmatched,Buy,Buy Logitech M190 Wireless Mouse Red in Pakistan | TechMatched,mouse,3050.0,https://techmatched.pk/product/buy-logitech-m190-wireless-mouse-red-pk-tm/
techmatched,Buy,Buy Logitech M185 Wireless Mouse in Pakistan | TechMatched,mouse,2800.0,https://techmatched.pk/product/buy-logitech-m185-wireless-mouse-in-pak-tm/
techmatched,Buy,Buy Logitech M185 Wireless Red Mouse in Pakistan | TechMatched,mouse,2750.0,https://techmatched.pk/product/buy-logitech-m185-wireless-mouse-in-pk-tm/
techmatched,Buy,Buy Logitech M171 Wireless Mouse in Pakistan | TechMatched,mouse,2650.0,https://techmatched.pk/product/buy-logitech-m171-wireless-mouse-in-pak-tm/
techmatched,Buy,Buy Logitech M170 Wireless Mouse in Pakistan | TechMatched,mouse,2450.0,https://techmatched.pk/product/buy-logitech-m170-wireless-mouse-pakistan/
techmatched,Buy,Buy Logitech B175 Wireless Mouse in Pakistan | TechMatched,mouse,2250.0,https://techmatched.pk/product/buy-logitech-b175-wireless-mouse-in-pk-tm/
techmatched,Buy,Buy EASE EMB100 Bluetooth Wireless Mouse in Pakistan | TechMatched,mouse,1800.0,https://techmatched.pk/product/buy-ease-emb100-mouse-pakistan-tehmatched/
techmatched,Buy,Buy EASE EM200 Wireless Mouse in Pakistan | TechMatched,mouse,1200.0,https://techmatched.pk/product/buy-ease-em200-wireless-mouse-pakistan-tm/
